{
  "type": "log",
  "stream": "logs",
  "seq": 42,
  "lines": [
    {
      "seq": 41,
      "at": "2026-10-24T03:00:00.000Z",
      "level": "INFO",
      "message": "Done (3.2s)!"
    },
    {
      "seq": 42,
      "at": "2026-10-24T03:00:00.000Z",
      "level": "CMD",
      "message": "> say hi",
      "commandId": "01JB2Z8Y3K4M5N6P7Q8R9S0TVW"
    }
  ]
}
